{
   "slug": "dino-egg-rescue",
   "universe": "shared-cast",
   "seed": 5050,
   "assets": [
      {
         "id": "volcano",
         "kind": "prop",
         "mode": "text",
         "prompt": "Stylised low-poly volcano, warm brown rock with green grassy base, glowing orange lava crater at the top, gentle slopes, stylised premium mobile game asset, clean PBR materials, no baked shadows, single solid object, chunky solid shapes, no thin wires or strands, centred on a plain background",
         "tier": "Gen-2.5-Medium",
         "qualityOverride": 3000,
         "attempts": 1,
         "target": "dino-egg-rescue",
         "budget": {
            "tris": 5000,
            "bytes": 300000
         },
         "textureSize": 512
      }
   ]
}
