{
   "slug": "ghost-vacuum",
   "universe": "shared-cast",
   "seed": 5050,
   "assets": [
      {
         "id": "vacuum",
         "kind": "prop",
         "mode": "text",
         "prompt": "Ghost-hunting vacuum backpack unit: an upright rounded cylinder canister with a flat back plate, two small round gauges and a glowing violet light strip on the front, a short hose connector at the bottom. Premium stylised mobile-game look, soft bevelled edges, simple clean shapes, matte white and slate grey with a violet glow strip. Single object, centred, upright, front facing the viewer, symmetrical. No shoulder straps, no hose, no nozzle, no base, no ground, no text, no logo. Clean game-ready low-poly topology, clean PBR texture without baked shadows.",
         "tier": "Gen-2.5-Medium",
         "qualityOverride": 1500,
         "attempts": 1,
         "target": "ghost-vacuum",
         "budget": {
            "tris": 2500,
            "bytes": 300000
         },
         "textureSize": 512
      },
      {
         "id": "ghost",
         "kind": "prop",
         "mode": "text",
         "prompt": "Cute friendly sheet ghost: a rounded body with three wavy tails at the bottom, two small raised arms, big dark oval eyes, a happy smile and rosy cheeks, pale lilac-white. Premium stylised mobile-game look, soft clean shapes. Single object, centred, upright, front facing the viewer. No base, no ground, no text. Clean game-ready low-poly topology, clean PBR texture without baked shadows.",
         "tier": "Gen-2.5-Medium",
         "qualityOverride": 2500,
         "attempts": 1,
         "target": "ghost-vacuum",
         "budget": {
            "tris": 5000,
            "bytes": 300000
         },
         "textureSize": 512
      },
      {
         "id": "candelabra",
         "kind": "prop",
         "mode": "text",
         "prompt": "A three-armed antique candelabra, tarnished gold metal with a round base, three thick candles with small solid flame shapes, stylised premium mobile game asset, clean PBR materials, no baked shadows, single solid object, chunky solid shapes, no thin wires or strands, centred on a plain background",
         "tier": "Gen-2.5-Medium",
         "qualityOverride": 1500,
         "attempts": 1,
         "target": "ghost-vacuum",
         "budget": {
            "tris": 5000,
            "bytes": 300000
         },
         "textureSize": 512
      }
   ]
}
