{
   "slug": "space-repair",
   "universe": "shared-cast",
   "seed": 2410,
   "assets": [
      {
         "id": "stationModule",
         "kind": "prop",
         "mode": "text",
         "prompt": "Space station module, white cylindrical hull with soft panel lines, orange and blue accents, a round hatch on one end, two solid solar panel wings, stylised premium mobile game asset, clean PBR materials, no baked shadows, single solid object, chunky solid shapes, no thin wires or strands, centred on a plain background",
         "tier": "Gen-2.5-Medium",
         "qualityOverride": 3000,
         "attempts": 1,
         "target": "space-repair",
         "budget": {
            "tris": 5000,
            "bytes": 300000
         },
         "textureSize": 512
      }
   ]
}
