{
   "slug": "construction-worker",
   "universe": "shared-cast",
   "seed": 2410,
   "assets": [
      {
         "id": "cementMixer",
         "kind": "prop",
         "mode": "text",
         "prompt": "Small construction cement mixer, orange tilted drum on a yellow frame with two wheels, stylised premium mobile game asset, clean PBR materials, no baked shadows, single solid object, chunky solid shapes, no thin wires or strands, centred on a plain background",
         "tier": "Gen-2.5-Medium",
         "qualityOverride": 1500,
         "attempts": 1,
         "target": "construction-worker",
         "budget": {
            "tris": 5000,
            "bytes": 300000
         },
         "textureSize": 512
      }
   ]
}
