{
   "slug": "obstacle-race",
   "universe": "shared-cast",
   "seed": 5050,
   "assets": [
      {
         "id": "finishArch",
         "kind": "prop",
         "mode": "text",
         "prompt": "one single inflatable finish line arch: a thick rounded tube forming an upside-down U on two red legs with a yellow top and a flat black and white checkered banner under the top, thin from front to back, only one arch, single isolated prop, no ground, game-ready low-poly",
         "concept": "tools/hyper3d/concepts/obstacle-race-finishArch.webp",
         "tier": "Gen-2.5-Medium",
         "qualityOverride": 3000,
         "attempts": 1,
         "target": "obstacle-race",
         "budget": { "tris": 5000, "bytes": 300000 },
         "textureSize": 512
      }
   ]
}
